,groupe,nom,interventions
0,SOC,Olivier Faure,"[' Pourquoi ? ', ' Pourquoi ? ', "" Je ne dirai rien de très original, car ce que viennent de dire mes collègues reflète le fond de ma pensée. Je constate une évolution par rapport à la version de la commission, mais j'aimerais comprendre quelle est la nature du changement par rapport à la proposition de loi initiale. Quelles sont les raisons pour lesquelles on maintient la sous-traitance alors que chacun sait que les raisons d'y recourir ne sont jamais liées à la technicité ? Pour du gardiennage, que ce soit dans un immeuble ou dans un bâtiment, il n'y a pas besoin de compétences particulières. La sous-traitance n'a pas d'autre objectif que de briser la traçabilité entre l'employeur et ..."", ' Exactement ! ', "" C'est normal, ils font usage de la force ! "", ' Madame la ministre déléguée, puisque vous nous dites que le rapport sera produit par la commission tripartite et que nous en disposerons avant de décider, je retire mon amendement. ', "" Mon argumentaire est le même que celui développé à l'instant par Bastien Lachaud. Si nos propositions prennent la forme de demandes de rapport, c'est parce que les règles de la discussion budgétaire nous y contraignent ; nous souhaiterions évidemment aller plus vite en la matière. "", "" Beaucoup a déjà été dit. Pour résumer ce que nous pensons tous, certaines mesures sont fortement symboliques : dans le cas présent, la loyauté et le courage doivent trouver reconnaissance. Personne ici n'imagine qu'à 100 000 malheureux euros près, nous ne puissions rendre justice à ces hommes, dont la plupart sont très âgés. Plus le temps passe, et moins ils seront nombreux. 4 000 euros pour prix de leur courage et de leur loyauté, c'est tellement peu ! Nous ne pouvons pas, cette année encore, repousser leur demande qui mériterait de faire l'unanimité dans l'hémicycle. Selon le Conseil constitutionnel, ils sont éligibles à l'allocation de reconnaissance ; ..."", "" Cet amendement vise à augmenter les dotations du programme 169 « Reconnaissance et réparation en faveur du monde combattant » de 38 millions d'euros, pour compenser en partie la baisse des crédits liée à la diminution annuelle de l'administration de la dette viagère, qui atteint près de 80 millions d'euros. "", "" Je les retire, monsieur le président. Chacun aura compris qu'il s'agissait d'amendements d'appel, qui n'avaient pas pour but d'ouvrir un débat à cette heure tardive. Chaque sujet évoqué mériterait en effet de plus amples débats. Il s'agissait d'attirer l'attention tant de la ministre que de la commission, afin que ces sujets fassent l'objet d'un suivi attentif et que nous puissions en reparler à l'occasion des prochaines séances de la commission. "", "" L'amendement no 1044 porte sur une demande de rapport sur les améliorations relatives à la coordination logistique entre emploi des personnels et utilisation des matériels, compte tenu des contraintes existantes au sein des armées de terre, de l'air et la marine, c'est-à-dire concrètement sur les difficultés rencontrées pour dégager du temps de formation en raison de l'indisponibilité des matériels due notamment aux opérations extérieures – OPEX. L'amendement no 1045 demande la remise d'un rapport sur les faiblesses de la préparation opérationnelle des forces armées, notamment de l'armée de terre. Le rapporteur pour avis de la commission de la défense en ..."", "" Bien que Mme la ministre ne me l'ait pas demandé, je retire les amendements. "", "" Puisque tous les amendements sont retirés l'un après l'autre, je tâcherai d'être bref. L'amendement no 1043 vise à abonder de 6,7 millions d'euros les crédits alloués au recrutement dans l'armée de terre, même si je sais bien que le premier levier de recrutement réside dans la politique indemnitaire, dont je crois comprendre que Mme la ministre s'engage à la réviser dans les meilleurs délais. L'amendement no 1042 est sans doute inspiré par la longue expérience de gouvernement de mon groupe : c'est un amendement de précaution qui vise à augmenter de 5 % la dotation gazole allouée aux armées afin de faire face aux incertitudes qui pèsent sur le cours du ..."", "" C'est un très bon amendement ! "", ' Mais il a défendu son amendement avec beaucoup de talent ! ', "" La présente discussion s'inscrit dans un contexte de crise sanitaire et de tragédies sur fond de terrorisme. Mes premiers mots seront pour le service de santé des armées, dont je tiens à saluer la contribution décisive à la prise en charge passée et – on peut le craindre – future des patients atteints du covid-19. Je tiens en outre à assurer de notre reconnaissance les 4 000 femmes et hommes qui vont participer à la montée en puissance du plan Vigipirate. Nous vivons un accroissement des menaces et des tensions au niveau international, y compris aux frontières de l'Europe. Face à l'affirmation d'acteurs enclins à remettre en cause les équilibres hérités ..."", "" Il n'est pas là ! "", "" Le Premier ministre n'est pas là ! Il faut interrompre les travaux ! "", ' Pas seulement dans les établissements scolaires ! ', "" Ce n'est pas la question ! "", ' Répondez donc à la question ! ', ' Exactement ! ', ' Ce ne sont que des mots ! ', "" La démocratie ne se marchande pas. Sur ce principe républicain-là, au moins, j'aimerais être certain que nous partageons la même vision, monsieur le Premier ministre. Alors je vous pose cette question très simple : est-il dans vos intentions de chef de gouvernement de reporter les élections régionales ? "", "" Mais cela ne peut pas être au prix d'un chantage et d'un tripatouillage électoral : moyens nouveaux contre report de l'élection régionale. "", "" Qu'allez-vous faire de cette défaite ? Les couloirs bruissent. Mais c'est moins un remaniement gouvernemental que les Français attendent qu'un remaniement de la politique que vous conduisez. L'acte 2 devait être plus social. Nous avons eu droit aux réformes de l'assurance chômage et des retraites. L'acte 3 devrait être écologique. Mais déjà la course de lenteur est engagée avec les propositions de la convention citoyenne pour le climat. Il y a un point sur lequel nous pourrions être d'accord : donner plus de pouvoirs et de moyens aux collectivités locales. "", "" … même cela n'a pas permis d'endiguer la victoire du bloc social et écologique. "", ' Même la clarification opérée au second tour – je veux parler de vos alliances avec la droite – … ', "" C'est la réalité ! "", "" Monsieur le Premier ministre, je veux d'abord vous adresser mes félicitations républicaines pour votre réélection à la mairie du Havre, mais – parce qu'il y a un « mais » – vous conviendrez avec moi que l'arbre ne peut pas cacher la forêt. Jamais un Président de la République n'avait subi un tel revers lors d'élections municipales. "", ' Nous aussi ! ', ' À tort ! ', "" Policiers et gendarmes méritent tout notre respect, mais il n'y a pas d'ordre sans justice. "", ' Celle-ci devra prendre la dimension réelle du sujet et déboucher sur des mesures de nature à réconcilier les Français avec leur police. ', "" Monsieur le Premier ministre, le malaise est profond. Il y a cinq ans, Renaud chantait : « J'ai embrassé un flic ». Comment, depuis lors, en sommes-nous arrivés à cette rupture de confiance entre nos concitoyens et ceux qui les protègent, parfois même au péril de leur vie ? En janvier déjà, après le décès de Cédric Chouviat, votre gouvernement avait assuré qu'il allait revenir sur les modalités de contrôle. Puis rien. Après être resté sourd à toutes nos alertes pendant deux ans, votre ministre de l'intérieur a enfin fait un pas de côté hier : insuffisant. Les clés d'étranglement ne seront plus enseignées, mais seront-elles interdites ? Par ailleurs, ..."", ' Oui ! ', ' On peut appeler ça des emplois aidés, si vous préférez ! ', "" Ma cinquième et dernière proposition tient en un seul mot : justice. Les plus riches doivent être ceux qui contribuent le plus. Dans le cadre d'une fiscalité réformée, acceptez-vous de répartir les efforts afin de ne pas creuser davantage les inégalités ? "", "" Monsieur le Premier ministre, je voudrais revenir sur l'état d'urgence sociale. Je l'ai entendu dans toutes les bouches : « Cette crise est un révélateur des inégalités. » Très bien. Et alors ? On pose ça là et on attend que ça passe ? On renvoie la résolution du problème à un monde meilleur qui, comme l'horizon, recule toujours ? Ou est-ce que l'on se retrousse les manches tout de suite pour que la justice progresse ? Je mets donc sur la table cinq propositions. Première proposition : l'abrogation de la réforme de l'assurance chômage. Les nouvelles règles, que vous avez posées, vont avoir des effets dévastateurs, notamment sur ceux qui n'ont pas pu ..."", "" C'est vrai ; mais il y a des magiciens qui savent le rendre transparent à nos regards. Alors, si vous voulez faire du tracking, traquez l'argent sale, celui qui s'évade quand tous les Français sont appelés au civisme ! Si vous voulez que notre présent anticipe un futur différent et donc plus solidaire, rétablissez dès à présent l'ISF, abrogez la flat tax, suspendez tous les cadeaux fiscaux indécents que vous faites aux plus riches alors que vous n'accordez qu'une prime à certains de ceux qui permettent aujourd'hui à ce pays de tenir debout ! Prenez des engagements forts ; montrez au pays que, comme nous, vous avez appris de cette crise ! Je n'achèverai pas mon ..."", "" De nouvelles interrogations naissent également depuis l'apparition, en Grande-Bretagne, en Espagne et en Italie, d'un syndrome proche de la forme sévère du coronavirus, qui frappe les enfants et nécessite leur hospitalisation en soins intensifs : a-t-elle un lien avec la crise qui nous occupe ? Voilà ce que les Français attendent de leurs gouvernants comme de chacun de leurs élus : qu'ils évaluent la situation et s'assurent que les meilleures garanties leur soient proposées. On ne joue pas avec la santé des Français à pile ou face – pile, on gagne ; face, l'épidémie repart ! Un déconfinement raté parce que mal préparé ruinerait les efforts consentis ..."", "" Les députés du groupe Socialistes et apparentés vous ont écouté attentivement, monsieur le Premier ministre. Vous avez la charge de l'essentiel : les vies de milliers de femmes et d'hommes qui ne résisteraient pas à l'infection du virus. En quelques mois, ce virus a miné nos quotidiens, confiné nos existences, bouleversé nos modes de vie, transformé notre rapport aux autres. Le confinement a permis d'enrayer la progression du Covid-19, mais pas de le faire disparaître. Si c'est une guerre, c'est une guerre de position, une guerre de tranchées, et chaque jour le front s'élargit à de nouveaux pays. Sans vaccin, sans traitement fiable, sans immunisation assurée, ..."", ' Très bien ! ', "" Monsieur le Premier ministre, puisque nous sommes en guerre, il nous faut nous donner les moyens de la guerre. Rien ne serait pire que d'annoncer un péril sans se donner les moyens nécessaires pour le vaincre. Il faut d'abord soutenir les premiers de tranchée : les soignants, les salariés de l'agroalimentaire, les agents de services publics doivent obtenir en priorité les moyens de protection. En l'absence de masques, de gants et de gel, seules les activités vitales devraient être maintenues. On est protégé ou on reste chez soi ! Il faut ensuite mobiliser les cliniques mutualistes et privées : êtes-vous disposé à les mettre à contribution, et quel rôle ..."", ' Exactement ! ', ' Ridicule ! ', ' Parle pour toi ! ', "" Pour ces différentes raisons, même si nous souscrivons aux critiques du groupe Les Républicains quant au caractère bâclé et illisible de la réforme, à l'échec de la concertation et à l'absence d'un débat complet en commission et en séance publique, même si nous condamnons recours au 49. 3 et le contournement des critiques du Conseil d'État, nous pensons que la politique suppose de la cohérence. Nous n'allons pas censurer un gouvernement qui fixe un âge d'équilibre à 65 ans pour mieux approuver un groupe qui propose de reculer l'âge légal à 65 ans. Par conséquent, le groupe Socialistes et apparentés ne votera pas une motion de censure dont les idées ..."", "" Au fond, vous reprochez au Gouvernement de ne pas aller assez vite. Là encore, pas de différence de fond entre vous, mais une différence de rythme. Pour notre part, nous pensons qu'il faut introduire partout des critères de pénibilité afin de permettre aux 25 % de salariés qui exercent leur métier dans des conditions difficiles de partir à la retraite plus tôt. "", "" Nous pensons, quant à nous, que les ressources de la CADES – Caisse d'amortissement de la dette sociale – et les revenus financiers peuvent financer la solidarité. Le second grand reproche formulé par la motion de censure est que le projet de loi « repousse l'extinction des régimes spéciaux ». ""]"
1,SOC,Christian Hutin,"["" Il n'y a qu'une chose à faire : valider leur stage ! "", ' Quel discours mortifère ! ', "" Le secteur est à l'agonie ! "", ' Les gens ne vont pas au supermarché, peut-être ? ', ' Mais les gens vont travailler ! ', "" C'est pour cela qu'ils sont fermés ! "", ' Ah ! ', ' Presque dix ans après ! ', "" Nous l'avons remarqué ! "", ' Et Véran, où est-il ? ', "" C'est vrai ! "", ' Que va donner le Gouvernement ? ', ' Eh oui, ce sont les départements qui paient ! ', ' Victor Hugo ! La barricade ! ', "" Tu es passé de l'autre côté de la barricade ! "", "" Monsieur le ministre, une voie législative est possible, proposée par Régis Juanico, Valérie Rabault, votre serviteur et l'ensemble des députés du groupe Socialistes et apparentés. Nous avons tout ce qu'il faut pour défendre ensemble la création d'un fonds d'indemnisation des victimes – pas seulement ceux qui étaient au premier rang, mais aussi les autres, comme la caissière de Calais… "", ' Tu me prends pour un imbécile ? ', "" J'aime ton mépris et ta modestie ! "", ' … qui est absolument terrible – je pourrais en donner un exemple très simple. Politiquement, cet arrêté ne peut pas être maintenu tel quel. On ne peut pas dire que ces gens qui ont servi la France ne seront pas servis comme la France doit les servir. Par ailleurs, le député Raphaël Gérard, que je ne connais pas et qui doit être un type extraordinaire, en a bavé comme un malade, comme beaucoup de types ici – parce que certains, parmi nous, en sont morts. Quand on voit ce que peuvent être les séquelles du covid, on comprend que vous devez absolument revoir votre copie, monsieur le ministre. ', "" Au lendemain de cet arrêté, les présidents des grands syndicats français disent qu'il est méprisant. Monsieur le ministre, je vous demande de revenir sur cet arrêté, … "", "" « Tous les professionnels soignants malades du covid seront reconnus au titre des maladies professionnelles, sans exception », déclarait le 21 avril 2020 le ministre des solidarités et de la santé, M. Olivier Véran. Voilà trois semaines, mardi, a été signé un arrêté dont je me contenterai de dire, si je suis très poli, qu'il est extrêmement restrictif. Il est tout petit, minable. "", "" La France, c'est la France, et l'État, c'est l'État ! "", "" L'État n'est pas respecté ! "", ' Un ancien socialiste ! ', "" C'était vraiment très convaincant – et très applaudi ! "", ' Et des concessions autoroutières ! ', ' Très bien ! ', "" C'est un mensonge ! "", "" C'est dit gentiment, mais c'est bien dit ! "", "" C'est une évidence absolue ! "", ' Bravo ! ', "" Il faut qu'il prenne des médicaments, monsieur le président ! "", "" Nous n'avons pas vociféré ! "", ' Et de sages-femmes ! ', ' Pas du tout ! ', ' Évidemment ! ', ' On est loin de la sagesse ! ', ' Ah ça, non ! Les leçons de morale, ça suffit ! ', ' Il y en aurait 1 200. ', ' Futur Président de la République ! ', ' Très bien aussi ! ', ' Très bien ! ', ' Très bien ! ', ' Très bien ! ', ' Parlez humain ! ', ' Vive Marielle ! ', "" si on pouvait faire la même chose avec le Bostwana, ce serait quand même formidable. Merci à Christian Di Pompeo pour son travail ; merci aussi à Marielle d'avoir rendu à la commission des affaires étrangères la place qui doit être la sienne dans cet hémicycle. "", "" Madame Rauch, je tiens à souligner que vous représentez très bien Mme de Sarnez et que celle-ci est certainement très heureuse que vous la suppléiez aujourd'hui dans sa fonction de présidente. C'est un plaisir de discourir avec vous, ainsi qu'avec M. le rapporteur, mon ami, de ce petit projet. Je remercie à cet égard Jean-Paul Lecoq et l'ensemble de son groupe d'avoir décidé que cet avenant serait discuté en séance publique. Je pense qu'il sera d'accord avec moi pour reconnaître la chance qu'a notre commission d'avoir une présidente comme la sienne. Grâce à elle, en effet, notre commission est revenue au coeur de l'Assemblée. Petit accord, disais-je. En ..."", "" C'est bien de le dire ! "", ' Nous sommes en France ! ']"
